Article_Name	Revision_Tag	Revision_Length	BLEU_Score	Section_Src	Line_No_Src	Source_Line	Section_Tgt	Line_No_Tgt	Target_Line	edit_distance
Know_You're_Hungry_(and_Avoid_Eating_when_You're_Not).txt	Begin_Revisions	1	0.498	Intro	5212	Physical hunger generally comes on gradually, can wait and stops when you've eaten a meal.	Intro	5297	Physical hunger generally comes on gradually, can wait and stops when you've eaten a meal; however, many times we eat even when we don't feel physically hungry.	70
Get_Rid_of_Indigestion.txt	Begin_Revisions	1	0.479	### Treating Indigestion Caused by Gastroesophageal Reflux Disease (GERD)	1378	Your doctor may prescribe a stronger, prescription-grade version of an H-2 receptor blocker.	### Taking Medication for Indigestion	1431	Depending on the severity of your symptoms, your doctor may also recommend a stronger, prescription-grade version of an H-2 receptor blocker.	56
Restore_Trust.txt	Begin_Revisions	1	0.322	## Steps	43	If they ask you how was the day tell them what you did, so then they won't think you are keeping something from them.	## Steps	75	In that way, they won't think you are keeping something from them.	52
Grow_Houseplants.txt	Begin_Revisions	1	0.42100000000000004	### Providing the Right Housing	9761	Also, a good garden store will have fertilizers of a specific group already available in a huge selection.	### Housing and Feeding the Plant	9928	Also, a good garden store will have a large selection of fertilizers for each specific group.	57
Use_SwappingLabor.Com.txt	Begin_Revisions	1	0.33299999999999996	## Steps	66	"Once your visit www.swappinglabor.com you will see ""Place Ad"" you will want to click this to get started."	## Steps	94	you will want to click this to get started.	62
Be_Cool_at_a_Pool_Party.txt	Begin_Revisions	1	0.62	### Acting Cool	2527	Similarly, if you're the last person to leave, you might be perceived as not knowing when it's time to go (uncool).	### Acting Cool	2582	Similarly, if you're the last person to leave, you might be perceived as not knowing when it's time to go (uncool), so try leaving when you notice that the party is starting to thin out.	71
Make_a_Card_Disappear.txt	Begin_Revisions	1	0.539	## Section::::Steps.	433	Now ask the audience to pick a row if they pick the row with the card discard the other and vice versa, next ask the audience again to pick two cards, if they pick the forcing card (the ace of spades) then keep those two and ask the audience to pick another if they pick the ace of spades then give it to them.	## Section::::Steps.	513	Next ask the audience to pick two cards, if one of the two is the forcing card (the ace of spades) then keep those two and ask the audience to pick another card if they pick the ace of spades then give it to them.	118
Assign_Household_Chores.txt	Begin_Revisions	1	0.43	## Steps	820	"These chores are normal chores, but something else may be put in, like ""organize the pantry."	## Steps	859	Some normal chores are making the beds, cleaning the rooms, feeding the pets, etc.These chores are normal chores, but something else may be put in, like organizing the pantry.	86
Bowl_an_Easy_Bowling_Strike_in_Wii_Sports.txt	Begin_Revisions	1	0.534	## Steps	65	Get the red guideline in line with the two last notches, the ones that are closest to you (these notches are slightly closer together than the rest).	## Steps	92	Get the red guideline that pops up when you are moving your Mii in line with the two last notches on the bowling alley floor (These notches are slightly closer together than the rest).	68
Succeed_in_a_Music_Career_on_the_Sims_3.txt	Begin_Revisions	1	0.327	## Steps	27	Also, read music books- these will improve your skill, and frequently attend guitar lessons at the theatre.	## Steps	44	Also, read music books, as these will improve your skill.	57
Get_Ungrounded.txt	Begin_Revisions	1	0.374	## Steps	38	Or ask them if you can shorten the days of being grounded.	## Steps	61	Or ask them if you can shorten the days of being grounded (for example, ask if you can only be grounded until Tuesday instead of Thursday).	81
Stop_a_Fight_at_a_Baseball_Stadium_if_It_Breaks_Out.txt	Begin_Revisions	1	0.63	## Warnings	249	If you feel upset at the person take a deep breath and relax for about 5 seconds or if it does not help and the person is still beating people call 911 and tell them that the person is mad this way they may be able to help you while you're talking to them.	## Warnings	294	If you feel upset at the person take a deep breath and relax for about 5 seconds or if it does not help and the person is still beating people, call emergency services and tell them that the person is mad.	81
Bid_a_Cleaning_Job.txt	Begin_Revisions	1	0.51	### Visiting the Space	1184	Ask them for specific details, like whether desks need to be straightened out or if you just need to clean the floors.	### Visiting the Space	1249	Ask them for specific details, like whether desks need to be straightened out, carpets need to be shampooed, or exterior windows should be wiped.	52
Dance_like_Jewel_from_Rio.txt	Begin_Revisions	1	0.402	### Getting into Character	306	(Costumes come in children and adult sizes)	### Getting into Character	348	There are also many other places to get your costume!(Costumes come in children and adult sizes)	53
Avoid_Weight_Gain.txt	Begin_Revisions	1	0.391	### Managing What You Eat	2572	This will help you establish where you are now.	### Managing What You Eat	2659	This will help you establish where you are now and give you a sense of what changes should be made.	52
Play_Beer_Die.txt	Begin_Revisions	1	0.345	### Playing Classic Beer Die	300	In classic beer die, this is the only way to score a point.	### Understanding the Rules and Objective	364	This is the only way to score in beer die, and it's equal to 1 point for your team.	58
Learn_the_Basics_of_Texas_Hold_Em.txt	Begin_Revisions	1	0.368	## Steps	412	"If you hold ""pocket"" face cards (2 of J, Q, K, or A), do not go all in pre-flop, that scares people out, then you can't build a pot."	## Steps	449	"If you hold ""a pocket pair"" (2 of J, Q, K, or A) or pocket face cards, do not go all in pre-flop except occasionally when you are playing ""heads up, one-on-one"", otherwise that just scares people out, so you can't build a pot by getting some more conservative players to see what they have on the flop."	191
Help_a_Child_with_Math_Anxiety.txt	Begin_Revisions	1	0.616	Intro	54	Either way, you can work to help them overcome their fears through building their confidence in math, encouraging them to think positively about the subject, and understanding and addressing the roots of their anxiety.	Intro	103	Either way, you can work to help them overcome their fears through building their confidence in math and encouraging them to think positively about the subject.	65
Get_Your_Class_Involved_on_wikiHow.txt	Begin_Revisions	1	0.5489999999999999	## Steps	442	Guide them through the writing process, and once the article is finished, categorize and publish on the site!	## Steps	488	Guide them through the writing process, and once the article is finished, categorize and publish on the site! For an added incentive, offer extra credit should a student's article become featured.	87
Get_Rid_of_the_Pouch.txt	Begin_Revisions	1	0.7809999999999999	## Steps	169	(breakfast, lunch, snack, dinner) each of your meals should have the right amounts, don’t pile stuff on to your plate, try using smaller plates, the smallest things can make a difference! your eyes will see the plate and your brain will assume yours eating a large plate of food! also, before having a second plate of food wait 10-20 minutes to see if you're actually hungry, it takes your stomach some time to digest and tell your brain that you are full!	## Steps	209	(breakfast, lunch, snack, dinner) each of your meals should have the right amounts, don’t pile stuff on to your plate, try using smaller plates, the smallest things can make a difference! Your eyes will see the plate and your brain will assume you're eating a large plate of food! Also, before having a second plate of food wait 10-20 minutes to see if you're actually hungry.	86
Swim_With_Stingrays.txt	Begin_Revisions	1	0.445	## Warnings	538	Wrap the wound in a makeshift bandage from any available clean,	## Steps	571	Wrap the wound in a makeshift bandage from any available clean, lint-free cloth soaked in hot water once the wound has stopped oozing.	71
Remove_a_Worm_Virus.txt	Begin_Revisions	1	0.409	### Windows	941	To access Safe Mode on Windows 7 or Vista: Reboot the computer.	### Windows	1007	To access Safe Mode on Windows 7 or Vista: Reboot the computer and tap the key repeatedly as it restarts until you arrive at the Boot Options screen.	86
Formulate_Strategy_for_a_Start_Up_Organization.txt	Begin_Revisions	1	0.44299999999999995	## Steps	1020	Now these are scarce commodities and any strategy plan conceived around attributes puts the organization ahead of the rest of the competition and positions you along with the best of the competition, and makes success that much less complicated.	## Steps	1067	Now these are scarce commodities and any strategic plan conceived to take advantage of such scarcity positions your organization along with the best of the competition, ahead of the rest, making success less based on chance and that much less complicated.	108
Make_Cotton_Candy_on_Animal_Jam.txt	Begin_Revisions	1	0.39399999999999996	## Steps	12	There are colors A B C D E F G and H.	## Steps	37	There are colors A B C D E F G and H. When you choose one, the bowl will fill up with strands of your color.	71
Make_LPS_Blood_That_Doesn't_Stain.txt	Begin_Revisions	1	0.568	## Section::::Warnings.	37	The fake blood doesn't stain your LPS - I have used it many times! Anyway, let's get started! The ingredients you will need are at the bottom of the page.	## Section::::Warnings.	69	The fake blood doesn't stain your LPS - I have used it many times! Anyway, let's get started!	61
Change_Your_Twitter_Username.txt	Begin_Revisions	1	0.32899999999999996	## Steps	1269	If your selected name is taken, choose a new name, or add some numbers or a slight twist to the name to see if it appears.	### Changing Your Twitter Username Online	1312	If your first choice for your name is taken, choose a new name or give your name a slight twist by changing the spelling or adding some numbers.	67
Apply_for_Express_Entry_in_Canada.txt	Begin_Revisions	1	0.644	### Meeting the Criteria for Express Entry	171	Search through Canada’s official job classification system here: https://www.canada.ca/en/immigration-refugees-citizenship/services/immigrate-canada/express-entry/eligibility/find-national-occupation-code.html#find to determine the codes for your work experience.	### Meeting the Criteria for Express Entry	251	Search through Canada’s official job classification system on the Government of Canada website to determine the codes for your work experience.	137
Make_Your_Heart_and_Mind_Work_Together.txt	Begin_Revisions	1	0.392	## Steps	1470	You’ll create a marriage of your heart and mind.	### Reconciling Your Mind and Intuition	1521	Eventually, you’ll start to find personal power in your decisions and create a marriage of your heart and mind.	64
Shop_at_Ikea.txt	Begin_Revisions	1	0.49	### Navigating the Store	1584	After you’ve picked up everything from the warehouse, head to the checkout line to buy the items you’ve decided on.	### Navigating the Store	1640	Head to the checkout line to buy the items you’ve decided on.	55
Prevent_the_Common_Cold.txt	Begin_Revisions	1	0.368	## Steps	3535	Wash your hands before eating, before and after the bathroom, and use a paper towel to open the door of a public bathroom.	### Practicing Good Hygiene	3585	Use a paper towel to open the door of a public bathroom.	67
Use_a_Compass.txt	Begin_Revisions	1	0.353	### Figure Out Which Way You Need to Head	8260	Take off local magnetic variation by twisting the degree dial.	### Using the Compass	8332	Take off local magnetic variation by twisting the degree dial the correct number of degrees to the left or right, depending on the declination.	81
Cure_Indigestion.txt	Begin_Revisions	1	0.466	### Considering Alternative Treatments	3393	Peppermint can help soothe some types of indigestion by calming your stomach muscles and improving bile flow, but it can cause more damage if your indigestion is related to acid reflux (GERD).	### Considering Alternative Treatments	3499	Peppermint can help soothe some types of indigestion by calming your stomach muscles and improving bile flow, it can also cause relaxation of the sphincter between the esophagus and the stomach, which can lead to worsening reflux.	86
Monoboard.txt	Begin_Revisions	1	0.49700000000000005	## Section::::Things You'll Need.	653	Anyone and everyone can learn to ride properly, smoothly, and flawlessly with a monoboard as opposed to the inaccurate reputation of being difficult and awkward.	## Section::::Things You'll Need.	709	Anyone and everyone can learn to ride properly, smoothly, and flawlessly with a monoboard.	71
Make_a_Female_Betta_Community.txt	Begin_Revisions	1	0.332	## Steps	132	Dont remove the most aggressive female as she is in control and if she is removed than the tank will turn into a blood bath.	## Steps	183	If she is removed, the tank will turn into a blood bath.	70
Clean_Vintage_Stereo_Equipment.txt	Begin_Revisions	1	0.479	## Steps	416	Contact cleaner can be used to remove corrosion or stubborn dirt from all of the stereo component's internal parts.	## Section::::Steps.	471	Contact cleaner can be used to remove corrosion or stubborn dirt from many of the stereo component's internal parts, but typically you will want to clean contacts that cause problems beyond looks.	83
Calculate_Escape_Velocity.txt	Begin_Revisions	1	0.491	## Tips	2042	The escape velocity does not at all depend on the mass of the object that is being launched because the mass of this object is reflected in both the potential energy provided by gravity as well as the kinetic energy provided by the movement of this object.	### Understanding Escape Velocity	2079	Note that the escape velocity is independent of the mass of the rocket formula_16 The mass is reflected in both the potential energy provided by Earth's gravity as well as the kinetic energy provided by the movement of the rocket.	91
Get_Rid_of_Fleas.txt	Begin_Revisions	1	0.45299999999999996	### Treating Fleas on Pets	38283	If you want to avoid using over-the-counter flea products that contain potentially irritating chemicals, make an apple cider vinegar spray by mixing equal parts water and apple cider vinegar in a spray bottle.	### Treating Fleas on Pets	38367	If you want to avoid using over-the-counter flea products that contain potentially irritating chemicals, apple cider vinegar can work by deterring fleas with its strong, unpleasant smell.	66
Keep_Chickens_Safe.txt	Begin_Revisions	1	0.46	## Steps	10	put stronger wire in front of weak wire and if you any of your strongest wire left use all of it a best defense is a good defense am I right?	## Steps	31	Put stronger wire in front of weak wire, and if you have any of your strongest wire left, use all of it.	53
Get_over_a_Guy_Who_Is_Using_You_for_Sex.txt	Begin_Revisions	1	0.445	### Limiting Contact	398	Oftentimes, we hang on to past lovers via things like Facebook and Twitter.	### Limiting Contact	457	Oftentimes, we hang on to past lovers via things like Facebook and Twitter; however, research indicates checking up on someone online will only prolong your anguish.	90
Tell_if_Your_Teenager_Is_Having_Sex.txt	Begin_Revisions	1	0.586	### Asking Teens About Their Sexual Behavior	160	If the conversation is going well, you may want to ask about their opinions about sex, and then ask about their personal sexual activ5.	### Asking Teens About Their Sexual Behavior	207	If the conversation is going well, you may want to ask for their opinions about sex, share some of your own views and experiences, and then ask about their personal sexual activity.	53
Get_a_Boyfriend_in_Two_Days.txt	Begin_Revisions	1	0.374	## Steps	280	Always wash, make sure you have clean hair, teeth, good breath, maybe putting some spray on would help before you aproach him,	## Steps	319	Always wash, make sure you have clean hair, clean teeth, good breath.	65
Inspire_Yourself.txt	Begin_Revisions	1	0.662	### Coming Up with Goals and Plans	918	"Take a big goal and break it down into several smaller ones that seem easier and more manageable to achieve, like “Exercise for 30 minutes three times a day this week."""	### Coming Up with Goals and Plans	992	"Take a big goal or project and break it down into several smaller ones that seem more manageable and easier to find daily inspiration for, like “Exercise for 30 minutes three times a day this week."""	52
Punish_a_Child_in_the_Right_Way.txt	Begin_Revisions	1	0.465	### Redirecting Toddler Behavior	1091	For example, if the child is pushing another child, you can remover her hands.	### Redirecting Toddler Behavior	1181	For example, if the child is pushing another child, you can remove her hands from the other child by placing her arms at her sides.	53
Take_a_Navy_Shower.txt	Begin_Revisions	1	0.5710000000000001	## Steps	896	"To improve the flow rate of your shower, you can install a ""flow controller"" from a local hardware store."	### Preparing for a Navy Shower	936	"You can install a ""flow controller"" from a local hardware store to make your navy shower even more efficient."	86
Create_Peeps_on_Roller_Coaster_Tycoon_3.txt	Begin_Revisions	1	0.327	## Warnings	170	Do not click the dice button in the bottom right corner if you do not want to change what your peep looks like.	## Tips	214	If you want to quickly change what the peeps look like, click the dice button in the bottom left corner.	83
Be_Safe_During_a_Cruise_Ship_Fire.txt	Begin_Revisions	1	0.306	## Steps	1504	Pack a flashlight or two with extra batteries in your luggage.	## Steps	1543	Pack a flashlight or two with extra batteries in your luggage, in case the ship’s interior lights are not working during a fire and your room and corridor are dark.	102
Get_Rid_of_Suggested_Posts_on_Facebook.txt	Begin_Revisions	1	0.38799999999999996	## Tips	1810	"If a particular user posts too much for you, you can choose to ""unfollow"" them."	## Tips	1873	If a particular user posts too much for you, you can unfollow them without unfriending them, which will prevent their posts from appearing in your News Feed.	87
Determine_the_Strength_of_Magnets.txt	Begin_Revisions	1	0.433	### Factors Affecting Magnetic Field Strength	1149	Samarium cobalt has the next highest coercive field strength, at 9,200 oersted, but a magnetic flux density of 10,500 gauss and an overall energy density of 26.	### Determining Factors that Affect Magnetic Field Strength	1230	But it has a magnetic flux density of 10,500 gauss and an overall energy density of 26.	74
Be_a_Witch.txt	Begin_Revisions	1	0.392	## Steps	4738	If you're looking specifically for information on Wicca, try Gerald Gardner and Scott Cunningham but try to avoid most other new age authors, particularly those published by Llewellyn.	## Steps	4775	If you're looking specifically for information on Wicca, try Gerald Gardner, Doreen Valiente and Scott Cunningham.	91
Create_a_Nerf_Arsenal.txt	Begin_Revisions	1	0.55	## Steps	1302	It should be comfortable and easy to use, and if it is a clip gun, put the Raider clip in it.	## Steps	1347	It should be comfortable and easy to use, and if it is a clip gun, put the Raider clip in it, or you could use the 6-7 clip because it's less obvious and lighter.	69
Taste_Wine.txt	Begin_Revisions	1	0.485	## Steps	14231	Sediment formation is a naturally occurring process in which polymerization causes the precipitation of colloids of pigmentation among other things that fall out of solution ti form small grainy sediment.	### Seeing and Smelling the Wine	14315	Sediment formation, which looks like dirt at the bottom of the glass, is a naturally occurring process in which polymerization causes the precipitation of colloids of pigmentation, among other things, to fall out of solution and form small grainy sediment.	59
Assemble_Jigsaw_Puzzles.txt	Begin_Revisions	1	0.335	Intro	5212	Satisfy yourself with your method of approach and graduate to a larger number of pieces (medium range 300 – 1000 pieces) with your next puzzles.	Intro	5294	Once you are satisfied with a method of approach, graduate to a larger number of pieces (such as a puzzle with 300 – 1000 pieces, or even larger).	64
Have_a_Prom_for_a_Muslim_High_School.txt	Begin_Revisions	1	0.5589999999999999	## Steps	212	Everyone should be able to have fun without breaking the rules! That is the whole point of having a Muslim prom.	## Steps	238	Everyone should be able to have fun without breaking the rules! That is the whole point of having a Muslim prom — so that you don't break your beliefs by going to a completely shirk prom.	75
Make_a_Secret_Extension_from_Within_Your_Minecraft_Home.txt	Begin_Revisions	1	0.369	## Steps	87	First you want to build the house in the suitable location for this paticular secret extension you need a flat wall from a cliff.	## Steps	131	For this particular secret extension you need a flat wall from a cliff.	60
Guess_Someone's_Astrological_Sign.txt	Begin_Revisions	1	0.49	Intro	34060	We are also not talking about Moon signs which are the persons inner personality, emotions and reactions to certain things in their life, so it could complicate pin pointing down just their Sun sign, since that only represents their characteristics.	Intro	34135	We are also not talking about Moon signs which are the person's inner personality, emotions, and reactions to certain things in their life, so keep in mind your ultimate goal when trying to determine someone's Zodiac sign.	83
Contact_Tim_Tebow.txt	Begin_Revisions	1	0.316	Intro	50	You can also mail a personal letter to the Tim Tebow Foundation.	Intro	95	You can contact Tebow through Facebook, Twitter, and Instagram, or mail a letter to the Tim Tebow Foundation.	53
Change_from_a_Poser_Goth_to_a_Real_One.txt	Begin_Revisions	1	0.491	### Learning About the Subculture	5742	Developed in the early 80s, ethereal wave was mainly represented by 4AD bands.	### Learning About the Subculture	5882	Developed in the early 80s, ethereal wave was mainly represented by bands from the British independent label created in 1979, 4AD.	57
Make_Fried_Rice.txt	Begin_Revisions	1	0.353	## Steps	15445	Fry for about two minutes, just enough to heat up the rice and mix all the ingredients together.	### Simple Fried Rice	15539	Fry the rice and the other ingredients together for 2-3 minutes, just enough time to heat up the rice and mix the ingredients.	61
Eat_Chicken.txt	Begin_Revisions	1	0.402	Intro	4514	chicken tenders, taters and gravy, I'll throw a biscuit, and a big ol cookie	Intro	4548	chicken tenders, taters and gravy, I'll throw a biscuit, and a big ol cookie3 chicken tenders, taters and gravy, I'll throw a biscuit, and a big ol cookieIts the time of year	98
Assign_a_Static_IP_on_Centos_Server_to_Prevent_Collision.txt	Begin_Revisions	1	0.517	## Steps	57	"It shood look something like below:press ""i"" to strat editing:Change BOOTPROTO=dhcp to BOOTPROTO=staticAdd the following according to your need:IPADDR= 10.0.0.99NETMASK=255.255.255.0GATEWAY= 10.0.0.01Press ""Esc"" then press ""Shift"" + "":"" and enter wq to save the changes."	## Steps	73	"Add the following according to your need:IPADDR= 10.0.0.99NETMASK=255.255.255.0GATEWAY= 10.0.0.01Press ""Esc"" then press ""Shift"" + "":"" and enter wq to save the changes."	103
Bleach_and_Tone_Dyed_Black_Hair.txt	Begin_Revisions	1	0.65	## Steps	2080	(some places say to wait for 60 mins but 25-30 did the job for my dyed black hair)	## Steps	2135	(some places say to wait for 60 mins but 25-30 did the job for my dyed black hair) Everyone's hairs different, and the healthier the better.	58
Cope_With_Self_Negativity.txt	Begin_Revisions	1	0.534	## Warnings	305	As good as it may seem at the time any life good or bad is worth living because at least you're feeling emotions and having experiences and that is more than you can do when you're dead.	## Warnings	342	As good as it may seem at the time, any life, good or bad, is worth living because at least you're feeling emotions and having experiences.	53
Prepare_a_Resume_for_a_Transcriptionist.txt	Begin_Revisions	1	0.47200000000000003	## Steps	242	Work experience: Experience counts in transcription field and every transcriptionist must highlight his/her experience in the resume.	## Steps	286	Every transcriptionist must highlight his/her experience in the resume.	62
Act_Like_Kate_Middleton.txt	Begin_Revisions	1	0.53	## Steps	407	Try to enter some prestigious university, like Oxbridge, Ivy league is perfect too(Kate studied at St Andrews University in Scotland)	## Steps	451	Ivy league is perfect too (Kate studied at St Andrews University in Scotland).	59
Title_Your_Work_of_Art.txt	Begin_Revisions	1	0.45299999999999996	## Tips	1755	If you want to leave it untitled or want to name it something else.	## Tips	1789	If you want to leave it untitled or want to name it something else that's fine too because without you there would be no art to name!	67
Build_Suspended_Corner_Shelves.txt	Begin_Revisions	1	0.629	### Building Triangle Corner Shelves	174	To get the proper length of the last piece of your frame, line up all three pieces of 1x2-inch (2.54x 5.08 cm) that you just cut to form one edge of the triangle.	### Building Triangle Corner Shelves	251	To get the proper length of the last piece of your frame, line up all three of the pieces of 1x2-inch (2.54x 5.08 cm) board.	54
