Article_Name	Revision_Tag	Revision_Length	BLEU_Score	Section_Src	Line_No_Src	Source_Line	Section_Tgt	Line_No_Tgt	Target_Line	edit_distance
Prepare_for_an_MRI.txt	Begin_Revisions	1	0.461	### Preparing Before the Exam	775	If you are claustrophobic, this experience can cause a great deal of anxiety.	### Preparing Before the Exam	830	If you are claustrophobic, this experience can cause a great deal of anxiety, and you may need a sedative before the test if you are anxious.	64
Add_Nitrogen_to_Compost.txt	Begin_Revisions	1	0.308	### Adding Gardening Materials to Compost	1815	Do not add badly diseased or insect-infested trimmings to your compost.	### Adding Gardening Materials to Compost	1883	Do not add badly diseased or insect-infested trimmings, or weeds that contain seeds to your compost unless your compost is hot enough to destroy them.	79
Write_a_Korean_Song.txt	Begin_Revisions	1	0.451	## Steps	429	When you are writing a foreign song, you could add some English words in it.	## Steps	460	Consider adding some English words to it when you are writing a foreign song.	60
Date_a_Vampire.txt	Begin_Revisions	1	0.45	## Steps	68	Of course if the vampire has been around for a century or more, so he knows the “it’s not you, it’s me” line.	## Steps	111	Of course, the usual line “it’s not you, it’s me” may not work because he'll claim he has been around for a century or more, and knows the “it’s not you, it’s me” line.	72
Ask_For_an_Increase_in_Allowance.txt	Begin_Revisions	1	0.363	## Warnings	241	Save some for later in life or for if something important comes up or if Dooney and Bourke comes out with a new bag...just kidding	## Warnings	269	Save some for later in life or for if something important comes up.	63
Compose_Your_Center_of_Interest.txt	Begin_Revisions	1	0.469	## Steps	701	The boat blends in with the building in the back and the photo could have been composed better.	### Background and Composition	741	For example, in this image, you can see that the boat blends in with the building in the background––the photo could have been composed better.	52
Do_Ombre_Nails.txt	Begin_Revisions	1	0.6809999999999999	### Creating The Glitter Ombré	9221	Remove any remaining nail polish currently on your nails with a cotton ball lightly soaked in nail polish remover.	### Creating The Sponge Ombré	9261	Use a cotton ball lightly soaked in nail polish remover to remove any nail polish currently on your nails.	84
Change_Object_Size_and_Spacing_in_Document_with_Kingsoft_Office_Writer_2013.txt	Begin_Revisions	1	0.5429999999999999	## Steps	34	To adjust the size or spacing of multiple objects, first select all of the objects that you want to adjust, and open the Drawing Tools tab.	## Steps	60	Select all of the objects that you want to adjust, and open the Drawing Tools tab.	58
Advertise_Small_Businesses.txt	Begin_Revisions	1	0.313	Intro	116	Advertising your small business can help you build a customer base and grow your business! Start your advertising campaign by creating a brand.	Intro	227	Advertising your small business can help you build a customer base.	76
Play_Tiddlywinks.txt	Begin_Revisions	1	0.542	## Steps	5362	Trying to put winks in the pot too early may end in disaster as your remaining playable winks become captured and your opponents can work their winks into the pot at leisure.	### Playing the Game	5452	Trying to put winks in the pot too early may end in disaster as your remaining playable winks become captured.	64
Identify_Whether_You're_the_Side_Chick.txt	Begin_Revisions	1	0.6409999999999999	## Steps	66	If he tells you he got jammed in traffic, bullshit! If he really wanted to get to you at your dark hour, he'll be running off the highway to make sure you're okay.	## Steps	101	If he really wanted to get to you at your dark hour, he'll be running off the highway to make sure you're okay.	52
Baby_Proof_Your_Computer.txt	Begin_Revisions	1	0.607	## Section::::Tips.	65	Half of the computer in America get ruined by little kids if you want your computer to stick around for a bit read this article on how to baby proof your computer.	## Section::::Tips.	86	If you want your computer to stick around for a bit read this article on how to baby proof your computer.	59
Get_Audible_Credits_on_PC_or_Mac.txt	Begin_Revisions	1	0.435	### Purchase Audible Credits	134	If you do not have an Amazon or Audible account, click .	### Enrolling in an Audible Membership	161	"If you do not have an Amazon or Audible account, click ""Create your Amazon account"" and follow the prompts to sign up."	62
Pick_Stocks_and_Other_Investments_With_Fundamental_Analysis.txt	Begin_Revisions	1	0.42200000000000004	## Tips	1723	"This article is about ""fundamental analysis"" which is, broadly, the study of factors that can be expected to affect the value underlying a stock or other security."	## Tips	1792	""" Broadly, it's the study of factors inherent to a company that can be expected to affect the value of its stock or other security."	76
Update_a_Toyota_Corolla_Car_Radio.txt	Begin_Revisions	1	0.431	## Steps	174	Knew there would be clips or something equivalent holding it there, so used a thin blade (metal spatula) to probe around there and try to pry the sides out.	## Steps	206	Use a thin blade (metal spatula) to probe approximately 2/3rd of the way up and try to pry the sides out.	97
Be_a_Great_Husband.txt	Begin_Revisions	1	0.41600000000000004	## Section::::Related wikiHows.	31746	But there are some common issues that many married couples face, and if you're dealing with them, the following guidelines will help you become a better husband.	Intro	31831	But there are some common issues that many married couples face, and part of being a great husband is being able to navigate and deal with these issues.	71
Convince_Your_Parents_to_Let_You_Go_to_a_Different_School.txt	Begin_Revisions	1	0.424	## Steps	713	If it's a no, no matter what, and your very very depressed then I am very sorry. :( I tried, I hope these steps were useful and have a great day/night!	## Steps	750	If it's a no, no matter what, and your very very depressed then I am very sorry.	71
Prevent_Skin_Infections.txt	Begin_Revisions	1	0.36200000000000004	## Steps	492	Keeping a cut covered with a bandage may prevent bacteria or fungus from entering the open wound and can reduce skin infections.	### Avoiding Specific Infections	552	Cover an open sore or cut with a bandage to keep it clean and dry and to prevent bacteria or fungus from entering the open wound.	80
Tell_Your_Parents_You_Are_Bisexual.txt	Begin_Revisions	1	0.409	### Having a Constructive Conversation	5099	Remember that the initial reaction does not always indicate how they really feel.	### Having a Constructive Conversation	5183	Remember that the initial reaction does not always indicate how they really feel; they may need some time to come to terms with the news and accept it.	70
Begin_to_Learn_SMAW_Welding.txt	Begin_Revisions	1	0.33799999999999997	## Steps	73	Create a labeled diagram of an arc welder in the shop. · Students will take a picture of an arc welder in class.	## Steps	105	Create a labeled diagram of an arc welder in the shop.	58
Mentally_Prepare_for_Surgery.txt	Begin_Revisions	1	0.49	## Steps	58	The first thing you’re going to want to do is get some answers, you may feel more confident about the surgery if you understand what is being done and why it is needed.	## Steps	82	You may feel more confident about the surgery if you understand what is being done and why it is needed.	65
Get_Rid_of_Gas_Pains.txt	Begin_Revisions	1	0.49200000000000005	### Getting Rid of Gas Pains Naturally	3071	Sometimes gulping liquids or eating food too quickly, drinking through a straw, chewing gum and smoking can cause an accumulation of air in the stomach, which can be relieved easily, quickly and painlessly by belching.	### Getting Rid of Gas Pains Naturally	3122	Accumulation of air in the stomach can occur from gulping liquids or eating food too quickly, drinking through a straw, chewing gum and smoking.	158
Be_a_Fashionable_Teen_Girl.txt	Begin_Revisions	1	0.345	### Hairstyles	92	You can get your hair relaxed, permed, or wear it natural! You can also get box braids, Sengalnese twist, or faux dreads.	## Section::::Hair.	160	You can get your hair relaxed, permed, or wear it natural.	63
Become_a_Fix_It_All_Householder.txt	Begin_Revisions	1	0.585	## Steps	967	The list here can seem endless, covering appliances, door hardware, plumbing, electrical, air conditioning, flooring, painting, exterior trim, roofing, and almost anything in between.	## Steps	1028	Then, as you need them, look up or purchase guides covering appliances, door hardware, plumbing, electrical, air conditioning, flooring, painting, exterior trim, roofing, and other specific topics.	61
Join_a_Marching_Band.txt	Begin_Revisions	1	0.45899999999999996	## Tips	1597	(But don't eat or drink anything but water right before you play!)	## Tips	1648	(But don't eat or drink anything but water right before you play!) Avoid milk products before long outdoor practices in the heat, or you will get sick.	85
Take_Your_Bike_on_the_Train.txt	Begin_Revisions	1	0.7	### Taking your Bike on Long-Distance Trains	1538	remove the wheels, handlebars, seats, and pedals and pack them into a bike box or large TV box, then ship it from a post office, UPS, or FedEx.	### Taking your Bike on Long-Distance Trains	1601	If you want to do it yourself, you should remove the wheels, handlebars, seats, and pedals and pack them into a bike box or large TV box, then ship the package from a post office, UPS, or FedEx.	53
Prevent_Mold_Growth_in_Your_Vacation_Home.txt	Begin_Revisions	1	0.452	### Inside Housekeeping	73	If you do find that you have mold, consider calling in a pro before you start ripping out walls and possibly cross-contaminating your rooms.	### Inside Housekeeping	124	If you do find that you have mold, consider calling in a pro.	79
Deal_With_Facebook_Stalkers.txt	Begin_Revisions	1	0.423	## Steps	109	"If they comment statuses just saying, ""lol"" or ""ok"" there is no need to even reply, and they don't even have a need to comment."	## Steps	161	"For example, if they comment on your statuses just saying, ""lol"" or ""ok"", don't even reply, and they won't have leverage left to keep that comment stream running."	75
Enjoy_the_Holidays.txt	Begin_Revisions	1	0.35100000000000003	### Managing Stress	526	Your to-do list will still be there when you get back.	### Managing Stress	571	Your to-do list will still be there when you get back, and giving your mind a chance to rest can be a big boost to your spirits.	74
Choose_Hypertension_Medication.txt	Begin_Revisions	1	0.434	Intro	491	Hundreds of millions of people worldwide have hypertension, also known as high blood pressure (HBP), which is a leading contributor to serious medical issues like heart attack and stroke.	Intro	631	Hundreds of millions of people worldwide have hypertension, also known as high blood pressure (HBP).	87
Make_a_Paper_Snake.txt	Begin_Revisions	1	0.306	### Using Toilet Paper Rolls	5491	Cut a long, skinny rectangle from a piece of red paper and cut a V shape into on end.	## Section::::Quick Summary.	5646	Lastly, cut a thin long rectangle out of red paper and cut a V into 1 end to make a forked tongue.	54
Add_Contacts_to_Skype.txt	Begin_Revisions	1	0.68	## Steps	14	"Pretend that a contact we want to add is ""Antoine Padva"" who lives in the United Kingdom; you found this contact ... now at this time click a little ""Add contact"" button pertaining to ""Antoine Padva""."	## Steps	39	"Click ""View"" button and you will see all the available records by the name ""Padva""; Pretend that a contact we want to add is ""Antoine Padva"" who lives in the United Kingdom; you found this contact ... now at this time click a little ""Add contact"" button pertaining to ""Antoine Padva""."	84
Keep_Dyed_Black_Hair_Healthy.txt	Begin_Revisions	1	0.423	## Section::::Tips.	155	KEEP HANDS AWAY: Don't run your hands through your hair, if you can help it (I should practice what I preach).	## Steps	179	Don't run your hands through your hair, if you can help it.	51
Prevent_Anemia_Naturally.txt	Begin_Revisions	1	0.507	### Prevent Anemia Naturally	975	If your doctor thinks that a supplement of iron, vitamin B12, vitamin C, folate, or any other vitamin or mineral is needed, follow their instructions.	### Prevent Anemia Naturally	1011	If you worry that you might not be getting enough from your food intake, you can take a supplement of iron, vitamin B12, vitamin C, folate, or any other vitamin or mineral.	102
Keep_Goggles_from_Fogging_Up.txt	Begin_Revisions	1	0.37799999999999995	Intro	93	As the outside of your goggles are colder than the side pressed against your face, any moisture trapped inside will eventually turn into condensation.	Intro	137	As the outside of your goggles is colder than the inside, any moisture trapped behind the lenses will turn into condensation over time.	56
Train_Attack,_Strength_and_Defense_on_Runescape.txt	Begin_Revisions	1	0.435	## Tips	965	Listen to music on an MP3 or iPod if you get bored.	## Tips	1010	Listen to music on an MP3 or iPod if you get bored, or make another page and watch a video on youtube or something.	64
Do_a_Round_off_Back_Handspring_Back_Tuck_on_the_Floor.txt	Begin_Revisions	1	0.313	## Section::::Related wikiHows.	3578	together and rebound as high as possible.	## Steps	3699	Think of it as a cartwheel but faster, and land with both feet together and rebound as high as possible.	63
Choose_Where_to_Incorporate.txt	Begin_Revisions	1	0.615	### Looking at Filing Fees	510	More information regarding filing procedures, due dates, penalties, and notices of pending dissolution can be found on the website of each state’s respective secretary of state's office.	### Looking at Filing Fees	590	Check your state’s respective secretary of state office website for more information regarding filing procedures, due dates, penalties, and notices of pending dissolution.	144
Write_Crime_Stories.txt	Begin_Revisions	1	0.6579999999999999	### Outlining the Plot	3423	Your mystery short story may be set in one room, one house, one city, or around the world; regardless, make sure that you provide a detailed and vivid description of the setting for your mystery short story.[3] Recognize that the size of the place will influence the development of your story.	### Outlining the Plot	3488	Your mystery short story may be set in one room, one house, one city, or around the world; regardless, make sure that you provide a detailed and vivid description of the setting for your mystery short story.	86
Determine_if_You_Get_a_Free_Upgrade_to_Windows_10.txt	Begin_Revisions	1	0.363	### Ensuring That You Have a Supported Version of Windows	106	If the version of the Windows OS installed is either Windows 7, Windows 8 or Windows 8.1, you are eligible for a free Windows 10 upgrade.	### Checking Your Current Version of Windows	147	Windows 7, Windows 8 and Windows 8.1 are eligible for a free Windows 10 upgrade.	61
Get_a_Flatter_Stomach_in_a_Week.txt	Begin_Revisions	1	0.508	Intro	5742	com, because I share how I lost 70 pounds in 4 and half months.	Intro	5813	And if you want to lose weight, read my story on www.weightloss-stories.com, because I share how I lost 70 pounds in 4 and half months.	72
Choose_the_Right_Dog_for_Your_Family.txt	Begin_Revisions	1	0.45299999999999996	## Steps	990	Many wonderful puppies and adult dogs have been abandoned or given up to animal shelters or breed rescue groups, and adopting a pet from one of these sources may mean saving a life.	### Assessing Your Needs	1026	Many wonderful puppies and adult dogs have been abandoned or given up to animal shelters or breed rescue groups.	69
Make_Wine_Vinegar.txt	Begin_Revisions	1	0.6459999999999999	## Steps	42	Cover with a towel (secured with a rubber band or string) and let it sit at room temperature, stirring vigorously when you think of it (preferably daily), until a thin, gelatinous film starts to form on the surface.	## Steps	78	Let it sit at room temperature, stirring vigorously when you think of it (preferably daily), until a thin, gelatinous film starts to form on the surface.	63
Lose_Your_Virginity_Without_Pain_(Girls).txt	Begin_Revisions	1	0.39799999999999996	### Before Having Sex	39854	Read up! Knowing exactly what goes where, what's normal, and what to expect can help ease a lot of your anxiety about having sex for the first time.	### Educating Yourself About Your Body	39956	Knowing what goes where, what's normal, and what to expect can help ease your anxiety.	62
Change_the_Mirror_on_a_1994___2004_Ford_Mustang.txt	Begin_Revisions	1	0.384	## Steps	186	Pry off the triangle shaped trim piece opposite the mirror, on the door just above where the dashboard meets the door panel NOTE: If you have the Mach 460 sound system, you will need to pry off the tweeter surround/cover instead.	## Steps	212	NOTE: If you have the Mach 460 sound system, you will need to pry off the tweeter surround/cover instead.	124
Finance_a_Business.txt	Begin_Revisions	1	0.581	## Section::::Sources and Citations.	337	Every business situation is different, and businesses in different industries and sectors have different ways of going about getting credit, as well as different kinds of costs.	## Section::::Steps.	355	Every small business is different, and businesses in different industries and sectors have different ways of going about getting credit.	53
Have_a_Healthy_Lifestyle_in_High_School.txt	Begin_Revisions	1	0.585	### Staying Healthy and Safe	1614	However, distracted driving can (and often is) fatal, and it can only take a split second of moving your eyes away from the road for an accident to occur.	### Staying Healthy and Safe	1724	Many adolescents don't think twice about texting while driving, talking on the phone, or engaging in other dangerous distractions; however, distracted driving can (and often is) fatal, and it can only take a split second of moving your eyes away from the road for an accident to occur.	132
Deal_With_Anger_and_Stress.txt	Begin_Revisions	1	0.514	## Steps	531	Maybe even pull out last year's jeans that you never wear because they aren't in style.	## Steps	566	Maybe even pull out last year's jeans that you never wear because they aren't in style! Anything that makes you revel comfy and at home for a nice relaxing feel.	74
Fight_With_Daily_Objects.txt	Begin_Revisions	1	0.68	## Steps	700	With examples like these in mind, take a look around you and use your own imagination.	## Steps	748	Look around you and use your own imagination, with examples like these in mind.	68
Tell_Someone_You're_an_Atheist.txt	Begin_Revisions	1	0.631	### Communicating Your Convictions	978	If you are asked what religion you observe during a job interview, you can easily redirect the question with something like “My religious schedule never interferes with my work schedule.”	### Communicating Your Convictions	1035	If you are asked what religion you observe during a job interview, you can easily redirect the question with something like “I do not feel like my spirituality is relevant to this interview.”	53
Make_Club_Penguin_Toddlers_Like_You.txt	Begin_Revisions	1	0.402	## Section::::Related wikiHows.	2542	Well this article should help you make your way to the top in the Tot Lot.	## Section::::Related wikiHows.	2585	(for non members or most members yes) Well this article should help you make your way to the top in the Tot Lot (unless you want to be a cp bay bee abuser).	82
Write_a_Realistic_Fiction_Book.txt	Begin_Revisions	1	0.524	## Steps	301	Once you have done all these things you might want to write a paragraph or a planning tree or something to organize your thoughts about the story.	## Steps	357	Write a paragraph or a planning tree or something to organize your thoughts about the story.	55
Care_for_Yourself_After_a_Miscarriage.txt	Begin_Revisions	1	0.395	### Taking Care of Yourself Emotionally	39	A miscarriage is a distressing experience for both the mother and partner.	### Taking Care of Yourself Emotionally	134	However, it's important to be be conscious of the fact that a miscarriage is a distressing experience for both the mother and the partner.	65
Manage_and_Grow_Your_Twitter_Account.txt	Begin_Revisions	1	0.625	## Steps	31	Sponsored Tweets - as the name implies, this is where you view ads by other TweetGlide members, as well as your ads.	## Steps	49	No more confusion or searching for the original tweet! 'Sponsored Tweets' - as the name implies, this is where you view ads by other TweetGlide members, as well as your ads.	57
Know_if_You_Have_Male_Pattern_Baldness.txt	Begin_Revisions	1	0.643	Intro	1114	Take notice of your risk factors, including your age, baldness patterns in your relatives, steroid usage, and prostate gland growth.	## Section::::In a Hurry?	1180	If you want to know if you have male pattern baldness, first take notice of your risk factors, including your age, baldness patterns in your relatives, steroid usage, and prostate gland growth.	62
Drink_Beer.txt	Begin_Revisions	1	0.467	### Pouring Your Beer Correctly	3660	"For the perfect beer, you need about 1"" to 1-1/2"" of ""head"" (the foamy stuff), or about 2.5-3 cm. To get at this, start by pouring the beer into your perfect glass at a 45-degree angle."	### Pouring Your Beer Correctly	3738	"For the perfect beer, you need about 1"" to 1-1/2"" of ""head"" (the foamy stuff), or about ."	96
Download_PC_Games_on_Mac_Computers.txt	Begin_Revisions	1	0.318	### Download PC Games to your Mac	1780	These sites are easy to find out.i.e you can get at https://gamesexploit.com/ .	### Download PC Games to your Mac	1834	These sites are easy to find out.i.e you can get at https://gamesexploit.com/ etc.After the PC games have been downloaded, you can play them from your Mac while logged into the Windows OS.	109
Sober_Up_Fast.txt	Begin_Revisions	1	0.496	Intro	2411	You are out drinking and having a great time with friends, when you stumble and fall or begin to slur your words, which makes you realize that maybe you have had a little too much to drink.	Intro	2449	You are out drinking and having a great time with friends, when you stumble and fall or begin to slur your words.	76
Be_a_Sweet,_Sexy_and_Irresistible_Guy.txt	Begin_Revisions	1	0.33299999999999996	## Steps	2167	Be fun at parties and dance; have good fun with with your friends--maybe a bit sarcastic, but be smart--not mean.	## Steps	2213	You can maybe be a bit sarcastic, but be smart--not mean.	62
Make_Coffee_Pin_Wheels.txt	Begin_Revisions	1	0.36700000000000005	## Steps	420	Beat white butter and when it becomes smooth, add caster sugar gradually, and cream it.	## Steps	458	When it becomes smooth, add the caster sugar gradually and then cream the butter and sugar together.	61
Download_Different_Search_Services_in_Internet_Explorer_9.txt	Begin_Revisions	1	0.434	## Steps	333	Make sure the description matches the type you want, and from your selected service.	## Steps	359	Make sure the description matches the type you want, and from your selected service, and that the category/type is listed as Search Provider below the item's title.	80
Make_a_Light_Controller.txt	Begin_Revisions	1	0.307	## Steps	673	Connect from CUSB label, L, the white wire in the picture to the other screw on the AC connectors for each of them. 	## Hook up the AC Outlets	752	Connect a wire from CUSB label L to the other screw on the AC connectors.	57
Install_a_Cooktop.txt	Begin_Revisions	1	0.444	## Section::::Sources and Citations.	240	After all, you're dealing with either electricity or gas while simultaneously working with an appliance that cost hundreds, even thousands, of dollars.	## Section::::Sources and Citations.	277	After all, you're dealing with either electricity or gas while simultaneously handling an expensive appliance.	56
Write_Emo_Songs.txt	Begin_Revisions	1	0.61	## Section::::Related wikiHows.	1374	Yage, Amanda Woodward, Rites of Spring, Embrace, Black Veil Brides, Falling In Reverse, Indian Summer, Belle Epoque, Antioch Arrow, and Twelve Hour Turn are all great examples of emo, also known as emotive hardcore.	## Section::::Related wikiHows.	1417	Yage, Amanda Woodward, Rites of Spring, Embrace, Indian Summer, Belle Epoque, Antioch Arrow, and Twelve Hour Turn are all great examples of emo bands.	68
Cook_Frozen_Lobster.txt	Begin_Revisions	1	0.441	### Preparing the Lobster for Cooking	1498	Then, put the plastic bag in a pot full of water, and put that in the refrigerator.	### Preparing the Lobster for Cooking	1579	A good way to thaw theme faster is to place in a plastic bag, put the plastic bag in a pot full of water, and into the refrigerator.	67
Search_for_Jobs.txt	Begin_Revisions	1	0.387	### Following Other Leads	2913	Like for-profit recruiters, temp agencies do their best to match you with a suitable position for a specified length of time The biggest downside to these placements is that they aren’t permanent.	### Following Other Leads	2987	Like for-profit recruiters, temp agencies do their best to match you with a suitable position based on your experience.	85
Make_Holy_Water_an_Essential_Part_of_Your_Home.txt	Begin_Revisions	1	0.41200000000000003	## Warnings	220	Don't let your little kids play with it.	## Warnings	252	deletion supported Holy water is very precious, blessed, and holy Don't let your little kids play with it.	66
Tell_If_a_Security_Camera_Is_On.txt	Begin_Revisions	1	0.494	## Steps	35	The time, the status will show your CCTV security camera is on or working well.# Login your IOS APP or Android APP for your products.	## Steps	49	The time, the status will show your CCTV security camera is on or working well.	54
