Article_Name	Revision_Tag	Revision_Length	BLEU_Score	Section_Src	Line_No_Src	Source_Line	Section_Tgt	Line_No_Tgt	Target_Line	edit_distance
Draw_Anthro_Chica_from_Five_Nights_at_Freddy's.txt	Begin_Revisions	1	0.523	## Steps	166	LOOK STUPIDLIKE! THATS WHAT! Chica should have blushed cheeks and skinny body parts if she is toy, but thicker parts and plain cheeks in the regular Chica realm side! Either way, she is the newest robotic human!	## Steps	196	Make hair! Chica should have blushed cheeks and skinny body parts if you are drawing the Toy version, but thicker parts and plain cheeks in the regular Chica realm side!	95
Hire_a_Professional_House_Cleaning_Service.txt	Begin_Revisions	1	0.7809999999999999	## Steps	18	Before you hire housekeeping services make sure that you have discussed and agreed upon the kind of cleaning you would require, the rooms you would want to be cleaned, the kind of cleaning supplies you would want them to use i.e. if you have allergies from some specific cleaning agents and want them to avoid using such supplies, the time and frequency at which you would like to use their services.	## Steps	28	Things like the kind of cleaning you would require, the rooms you would want to be cleaned, the kind of cleaning supplies you would want them to use i.e., if you have allergies from some specific cleaning agents and want them to avoid using such supplies, the time and frequency at which you would like to use their services.	80
Make_a_Beer_Bottle_Bud_Vase.txt	Begin_Revisions	1	0.439	## Section::::Steps.	476	Don’t worry about complete coverage, but instead make sure	## Steps	559	Don’t worry about complete coverage, but instead make sure you evenly coat the entire bottle to provide a base coat.	58
Cope_with_the_Fear_of_Abandonment_with_a_Mental_Disorder.txt	Begin_Revisions	1	0.532	Intro	143	The fear of abandonment often goes hand-in-hand with some mental disorders, such as borderline personality disorder.	Intro	189	The fear of abandonment often goes hand-in-hand with some mental disorders, such as borderline personality disorder, bipolar disorder, major depressive disorder, anxiety disorders, and more.	74
Wait_on_Christmas_Morning_to_Open_Presents.txt	Begin_Revisions	1	0.537	## Warnings	2022	Beware, even though your urge will be somewhat calmed, this is a spoiler.	## Warnings	2080	Beware, even though your urge will be somewhat calmed, this is a spoiler, and you may be caught if you leave obvious evidence.	53
Stay_in_a_Dormitory_Hotel_Without_Trouble.txt	Begin_Revisions	1	0.39899999999999997	## Steps	196	Have a small chitchat if your roommates are in a friendly mood, it always helps you to stay in the room comfortably.	## Steps	232	Have a small chitchat if your roommates are in a friendly mood.	53
Slow_Cook_Brussels_Sprouts.txt	Begin_Revisions	1	0.5920000000000001	### Serving and Storing Your Brussels Sprouts	69	A light sprinkling of a cheese such as Parmesan can add extra flavor to your brussels sprouts.	### Serving and Storing Your Brussels Sprouts	107	A light sprinkling of a cheese such as Parmesan can add extra flavor to your brussels sprouts, as can other flavorful cheeses like asiago and mozzarella.	59
Reduce_Unnecessary_Antibiotic_Use.txt	Begin_Revisions	1	0.39299999999999996	Intro	204	Antibiotics are medications that kill bacteria and they can be lifesaving for people who have serious bacterial infections.	Intro	271	Antibiotics are medications that kill bacteria and they can be lifesaving for people who have serious bacterial infections; however, antibiotics have been irresponsibly and mistakenly prescribed for non-bacterial infections and other diseases for many decades, which has had serious repercussions.	174
Set_up_a_Kindergarten_Classroom.txt	Begin_Revisions	1	0.36200000000000004	## Steps	1908	Many teachers have colorful rugs down, or a single low table in the middle.	## Steps	1965	Many teachers have colorful individual rug tiles, a single low table in the middle, or a large rug that delineates the meeting area.	68
Supercharge_Collaborative_Decisions.txt	Begin_Revisions	1	0.41700000000000004	## Tips	332	"The power of the method is that it is a ""high leverage"" process.—It provides exceptional return for each unit of time and energy expended."	## Tips	429	"The power of the method is that it is a ""high leverage"" process."	74
Make_a_Margarita.txt	Begin_Revisions	1	0.313	### Making a Simple 3-ingredient Margarita	25665	To do this, wet the rim of the glass with a lime, then place the cup in a shallow saucer filled with a coarse-grained salt such as kosher or sea salt.	## Section::::Quick Summary.	25929	To make a classic margarita, wet the rim of your glass with a lime wedge, then salt the glass’s rim with kosher or sea salt.	86
Stretch_Boots.txt	Begin_Revisions	1	0.513	### Using Boot Stretchers	3342	Typically you should leave the stretcher in for 24–48 hours, but if you're worried the boots might become too loose, you should test them after 8 hours of waiting.	### Using Boot Stretchers	3476	If you're worried the boots might become too loose, you should test them after 8 hours of waiting.	66
Plan_Your_Visit_to_Ghana.txt	Begin_Revisions	1	0.444	## Section::::Steps.	340	Like most countries in Africa,Ghana can be visited all year-round.Her tolerable weather allows travelers to visit this magnificent country anytime they so desire.	## Steps	361	Her tolerable weather allows travelers to visit this magnificent country anytime they so desire.	66
Clean_Partially_Erupted_Wisdom_Teeth.txt	Begin_Revisions	1	0.721	### Treating Wisdom Teeth Pain	711	Doctors usually perform surgery for a number of reasons including: serious infection or gum disease around your wisdom teeth, tooth decay of the partially erupted teeth, or wisdom teeth that are harming surrounding teeth.	### Treating Wisdom Teeth Pain	781	Doctors usually perform surgery for a number of reasons including: serious infection or gum disease around your wisdom teeth, tooth decay of the partially erupted teeth, to make room for other teeth to align properly during orthodontic treatment, or wisdom teeth that are harming surrounding teeth.	77
Make_Better_Yu_Gi_Oh!_Decks.txt	Begin_Revisions	1	0.414	## Steps	754	Pick an attribute like fire or water or a type like dragon or spellcaster, this opens up a lot more options but the individual cards will work less well together.	## Steps	799	This opens up a lot more options but the individual cards will work less well together.	76
Completely_Disable_Google_Chrome_Update.txt	Begin_Revisions	1	0.41700000000000004	### Disabling Google Chrome Update Checks:	234	Click enabled button and in the scrollbar list under Policy choose Updates disabled and click OK You have now stopped Google Updater from checking for updates for Google Chrome.	### Disabling Google Chrome Update Checks:	269	Click enabled button and in the scrollbar list under Policy choose Updates disabled and click OK	81
Fix_Your_Lag_on_Games.txt	Begin_Revisions	1	0.308	## Section::::Things You'll Need.	109	Sometimes when we play games on computer	## Section::::Things You'll Need.	149	Sometimes when we play games on computer we are lagging so much and our computer have good index.	57
Apply_Lipstick_Without_Liner.txt	Begin_Revisions	1	0.48	## Tips	126	Apply lip balm to keep your lips moist and hydrated.	## Tips	177	Apply lip balm to keep your lips moist and hydrated to keep your lipcolor vibrant and your lips hydrated.	53
Take_Care_of_Your_Cricket_Bat.txt	Begin_Revisions	1	0.42100000000000004	## Tips	633	Using either a smooth wooden mallet or an old, quality leather cricket ball, repeatedly strike the face, edges and toe of the bat whilst gradually increasing the force of the strike over time.	## Section::::Using the Mallet.	702	In each case, repeatedly strike the face and edges of the bat whilst gradually increasing the force of the strike over time.	78
Eat_Wild_Rabbit.txt	Begin_Revisions	1	0.37	## Warnings	2383	Some areas, such as water conservation districts, have laws against composting animal parts, so be sure to check with your local law enforcement for acceptable disposal methods.	## Warnings	2441	Some areas, such as water conservation districts, have laws against composting animal parts.	85
Pay_for_College_Debt_Free.txt	Begin_Revisions	1	0.39799999999999996	### Working Before/During College	788	Working part-time during the school year and full-time during the summers can be an excellent way to offset expenses.	### Working Before/During College	861	Working part-time during the school year and full-time during the summers can be an excellent way to offset expenses, and unless you are able to secure a full-scholarship, this will be a key component of your plan to pay for college debt free.	126
Get_Online_Health_Advice.txt	Begin_Revisions	1	0.368	## Steps	80	Often these sites try to fool their clients by using the terms like ancient remedies, natural, scientific remedies etc. But investing in these products are actually the wastage of money or flat-out dangerous to the health of the users.	## Steps	103	Often these sites try to fool their clients by using the terms like ancient remedies, natural, scientific remedies etc.	116
Pick_Stocks_and_Other_Investments_With_Fundamental_Analysis.txt	Begin_Revisions	1	0.45399999999999996	## Tips	1729	"Convertible bonds, other elaborate investments, and ""derivatives"", i.e., bets (sometimes hedges) on the performance of other investments, can be somewhere in between and involve numerous other factors very difficult for nonprofessional investors to analyze coherently."	## Tips	1798	"Convertible bonds, ""derivatives"" (bets), and other elaborate investments may depend on the performance of other instruments and can involve numerous other factors very difficult for nonprofessional investors to analyze coherently."	84
Get_a_Good_Pokémon_in_Wonder_Trade_(Pokémon_X_and_Y).txt	Begin_Revisions	1	0.359	## Section::::Warnings.	84	we want a good Pokémon in X and Y,	## Section::::Things You'll Need.	119	We all know that we want a good Pokémon in X and Y, so here is how to get one without Pokémon Bank!	65
Admit_to_a_Foot_Fetish.txt	Begin_Revisions	1	0.32799999999999996	### Laying the Groundwork	4259	"If you're just in the middle of your first date, or even kissing for the first time, saying, ""I have a foot fetish!"" is likely to turn your night in the wrong direction."	### Laying the Groundwork	4314	"If you're just in the middle of your first date, or even kissing for the fi-- 09:48, 21 June 2014 (UTC)-- 09:48, 21 June 2014 (UTC)-- 09:48, 21 June 2014 (UTC)-- 09:48, 21 June 2014 (UTC)-- 09:48, 21 June 2014 (UTC)-- 09:48, 21 June 2014 (UTC)rst time, saying, ""I have a foot fetish!"" is likely to turn your night in the wrong direction."	168
Upload_a_Joomla_Website_to_the_Host.txt	Begin_Revisions	1	0.4	## Steps	25	chang these details to match your database name and password: var $log_path = '/var/www/vhost/domain.com/home/html/logs';	## Steps	70	var $log_path = '/var/www/vhost/domain.com/home/html/logs';	62
Bathe_a_Shih_Tzu_Puppy.txt	Begin_Revisions	1	0.484	## Tips	148	Even though the puppy shampoo is tearless, try not to get it in your puppy's eyes, as it might irritate them.	## Tips	212	Even though the puppy shampoo is tearless, try not to get it in your puppy's eyes, as it might irritate them. *If your dog will tolerate it you can put cotton balls in ears to prevent water from getting in and causing ear infections.	124
Write_an_Essay.txt	Begin_Revisions	1	0.594	## Steps	3392	Do not use stylistically weak, hackneyed expressions such as, “This essay is about...”, or “The topic of this essay is...”.	## Steps	3475	"Do not use obvious expressions such as, ""This essay is about..."" or ""The topic of this essay is..."" or ""I will now show that...""."	62
Get_the_Justin_Bieber_Haircut.txt	Begin_Revisions	1	0.365	### Cutting the Sides and Back	2300	If your hair won't hold the parts, secure the hair on the top of your head with hair clips.	### Cutting Justin's Quiff or Undercut	2410	If you used clips to hold the hair on the top of your head, be sure to remove them first.	53
Optimize_Your_Website_for_Search_Engine_Use.txt	Begin_Revisions	1	0.36700000000000005	## Tips	3540	Sitemap placing frequently solves a problem of indexation and site reindexation.	### Page Format Issues	3577	Sitemap placing frequently solves a problem of indexation and site reindexation.* If you have a local business, get listed in the Google Local Business search results.	87
Preserve_an_Umbilical_Cord.txt	Begin_Revisions	1	0.45899999999999996	### Getting a Cord	124	Go ahead and kindly remind them that you’d like to keep the cord.	### Getting the Cord	179	After you’ve been admitted to the hospital, go ahead and kindly remind your doctor that you’d like to keep the cord.	56
Make_Flour_in_RuneScape.txt	Begin_Revisions	1	0.405	## Tips	49	Make sure that you have a pot because you will not be able to take the flour	## Warnings	92	Make sure you have a pot before you start the milling process, or you will not be able to take the flour from the mill.	55
Download_Free_Music.txt	Begin_Revisions	1	0.5589999999999999	### Free Downloads from Popular Sites	5944	All free music sites, all legal downloads.	### Using Music Communities	6096	Another great site is http://freemp3downloads.info.All free music sites, all legal downloads.	51
Use_Apple_Cider_Vinegar_for_Dogs.txt	Begin_Revisions	1	0.37	### Using ACV Topically	2945	After bathing your dog, brush the vinegar through the dog's coat; not only does this improve the shine but also deodorizes the dog.	### Washing Your Dog with Apple Cider Vinegar	3022	After bathing your dog, brush the vinegar through the dog's coat.	66
Play_Dodgeball.txt	Begin_Revisions	1	0.546	### Playing Dodgeball on a Court	13605	Make sure to only throw balls below the level of the other players’ shoulders to avoid hitting them in the head.	### Playing Dodgeball on a Court	13679	Make sure not to throw the balls too hard or you may hurt someone! Also, only throw balls below the level of the other players’ shoulders to avoid hitting them in the head.	60
Understand_American_Terms.txt	Begin_Revisions	1	0.32799999999999996	## Warnings	14619	"Do not use the term ""colored people"" either."	## Warnings	14708	"Do not use the term ""colored people"" or ""negroes"" either as these terms are outdated and will be perceived as racist."	73
Power_a_Car_Amplifier_Using_a_Computer_Power_Supply.txt	Begin_Revisions	1	0.355	## Steps	42	Group all the ground wires together (except the one from step 3) by cutting them from the pins and Striping the ends (Refer to the Pinout diagram to know which color the grounds are.	## Steps	71	Group all the ground wires together (except the ground wire ) by cutting them from the pins and stripping the ends.	80
Build_a_Loving_Relationship_with_Your_Mother‐in‐Law.txt	Begin_Revisions	1	0.363	## Section::::Warnings.	508	Your mom loves you a lot, but think to yourself; how much does a woman love her daughter's or son's spouse?	## Section::::Warnings.	551	Your mom loves you a lot, but you might be thinking to yourself, just how much does this woman love me?	55
Gain_Respect_After_a_Major_Setback.txt	Begin_Revisions	1	0.6609999999999999	## Steps	912	A good example of this was T.I., who filmed the documentary style MTV show Road to Redemption, which can be found at http://www.mtv.com/shows/road_to_redemption/series.jhtml#moreinfo.	## Steps	947	A good example of this was T.I., who filmed the documentary style MTV show Road to Redemption.	89
Make_a_Light_Controller.txt	Begin_Revisions	1	0.63	## Things You'll Need	408	AC Connectors from Home Depot (You can get more depending on how many Christmas Lights you are trying to control,	## Things You'll Need	480	AC Connectors from Home Depot (You can get more depending on how many Christmas Lights you are trying to control, remember you can also put Christmas lights in series per relay)	64
Sight_a_Bow_In.txt	Begin_Revisions	1	0.3	## Steps	486	Using the top pin of the sight, line up on the target and fire 3 arrows.	## Steps	536	Aim down the sight using the second pin and fire off a few arrows at the target.	54
Draw_the_Japanese_Tsunami_2011.txt	Begin_Revisions	1	0.42	## Steps	166	Start by drawing the sky, the sky has to be gloomy, try to remember that it was a upsetting day and also a frightening day.	## Steps	181	Try to remember that it was a upsetting day and also a frightening day.	53
Read_Piano_Tabs.txt	Begin_Revisions	1	0.33	## Steps	292	Each line begins with a number and bar:	## Steps	330	Each line begins with a number and bar:codice_1The number indicates the octave the notes on the line are in.	69
Breed_Labradors.txt	Begin_Revisions	1	0.612	### Verifying the Health of Your Labradors	494	Let them know that you’d like them to check for any potential medical problems that could endanger the pregnancy or cause complications.	### Verifying the Health of Your Labradors	556	Let them know that you’d like them to check for any potential medical problems that could endanger the pregnancy or cause complications, and that you need your labradors to be up-to-date on their vaccinations.	73
Partition_a_Mac.txt	Begin_Revisions	1	0.625	## Steps	123	It happens not so often comparing to Windows (I witnessed hundreds of times Blue Screen on Win7 just this year), but when it happens you may lose your data forever: email settings, pictures, garageband songs, iwork documents, Ichat and calendar history, and so on.	## Steps	166	It happens not so often compared with Windows, but when it happens you may lose your data forever: email settings, pictures, garageband songs, iWork documents, iChat and calendar history, and so on.	73
Graph_Inequalities.txt	Begin_Revisions	1	0.354	### Graphing a Linear Inequality on a Number Line	9006	For example, for the solution formula_7, you would draw an arrow pointing to the right, since the solution includes values greater than 1.	## Section::::Quick Summary.	9096	For example, for an equation that solves as y > 1, you would draw a circle on 1 and an arrow pointing up, since the solution includes all values greater than 1.	57
Learn_Business_Accounting.txt	Begin_Revisions	1	0.342	### Looking for Continuing Education Opportunities	806	One of the most well-known accounting certifications is Certified Public Accountant (CPA).	### Looking for Continuing Education Opportunities	859	It is similar to the Certified Public Accountant (CPA) certification in public accounting.	60
Play_Love_Live!_(Video_Game).txt	Begin_Revisions	1	0.565	### Participating in the events	151	Like how many hours a day they put into this game.	### Befriending Other Players	212	Start discussing techniques with your new friend, like how many hours a day they put into this game.	51
Use_a_Headache_Diary.txt	Begin_Revisions	1	0.5870000000000001	### Creating Your Diary	3337	Look at the National Headache Foundation’s template for a headache diary: Find it at: http://www.headaches.org/wp-content/uploads/2015/02/248072334-Headache-Diary-from-the-National-Headache-Foundation.pdf.	### Creating Your Diary	3415	Look at the National Headache Foundation’s template for a headache diary.	132
Market_a_Kindle_Book.txt	Begin_Revisions	1	0.486	### Ongoing Promotion	1604	Blog, gossip, offer advice and ask for help on forums and keep commenting on other people's blogs (keeping self-promotion down to less than 25%).	### Ongoing Promotion	1674	Keep commenting on other people's blogs (keeping self-promotion down to less than 25%).	59
Act_Like_Brock_Lesnar_from_WWE.txt	Begin_Revisions	1	0.37799999999999995	## Steps	58	Brock Lesnar eats mostly fruit every day but you shouldn't go that far.	## Steps	81	Brock Lesnar eats mostly fruit every day but you shouldn't go that far instead eat plenty of fruit and veg and eat beans, meat (without the fat), and seafood.	87
Train_Your_Service_Dog_Without_a_Professional_Trainer.txt	Begin_Revisions	1	0.605	## Section::::Steps.	71	You want a service dog because you have a physical or mental disability, but you don't want to be on a waiting list for years, or you can't afford one.	## Section::::Steps.	93	If you want a service dog because you have a physical or mental disability but you don't want to be on a waiting list for years, or you can't afford such a trained dog, it may be possible for you to train a dog yourself.	72
Get_Someone_With_the_Wormdo_Trick.txt	Begin_Revisions	1	0.34	## Steps	40	"Zing 'em: ""Wriggles along the ground like this"" - say this while wriggling your finger along in the air."	## Steps	67	"Zing 'em: ""Wriggles along the ground like this."	57
Make_a_Text_Based_Game.txt	Begin_Revisions	1	0.354	## Warnings	5851	Try to avoid constructing your story around amnesia, flashbacks, mundane s	## Warnings	5938	Try to avoid constructing your story around amnesia, flashbacks, mundane settings (an apartment or office), or ordinary people who get transported to heroic fantasy settings.	100
Discipline_a_Blind_or_Visually_Impaired_Child.txt	Begin_Revisions	1	0.375	### Modifying Problematic Behaviors	160	Describe each behavior, where it occurs, who is involved when it occurs, and when the behavior occurs.	### Modifying Problematic Behaviors	207	Think about where and when the behavior occurs, as well as who is involved when it happens.	70
Be_Preppy_on_Club_Penguin.txt	Begin_Revisions	1	0.341	## Steps	5006	Pretend to chew gum, text, listen to your iPod, read magazines, and other girly stuff.	## Steps	5089	"Pretend to chew gum, text, listen to your iPod, read magazines, write in your diary (Say ""Writes in diary"" ""I think I like *boy's name*"" and then drop your diary 'accidentally') and other girly stuff."	114
Pack_for_College.txt	Begin_Revisions	1	0.40399999999999997	### Clothing	22558	It's recommended that you bring only what you'd consider to amount to three weeks worth of clothes suited to the season.	### Clothing	22696	Try to limit your clothing to three weeks worth of clothes suited to the season.	51
Write_an_Article_for_Your_School_Newspaper.txt	Begin_Revisions	1	0.456	Intro	13750	Writing an article for your [[Start a School Newspaper|school newspaper]] can be exciting and rewarding, especially once you see your name in print! To write an article, you’ll need to decide which type of article you’d like to write, research your topic, interview sources, and write it in the proper newspaper format.	Intro	13834	To write an article, you’ll need to decide which type of article you’d like to write, check on submission guidelines, research your topic, interview sources, and write it in the proper newspaper format.	167
Be_Desirable_to_a_Recruiter.txt	Begin_Revisions	1	0.33899999999999997	## Steps	21	Be ready to accept a suitable job offer.	## Steps	58	Be ready to accept a suitable job offer, commit to the new job and resign from your current position.	61
Block_Contacts_on_WhatsApp.txt	Begin_Revisions	1	0.332	## Steps	587	They will not be able to see any updates to your profile picture or name, but they will still be able to see your status changes.	## Tips	655	Blocked contacts will not be able to see any edits to your profile picture, name, or status updates from the time you block them.	62
Make_Dough_Without_Yeast.txt	Begin_Revisions	1	0.49200000000000005	### Making No-Yeast Pizza Dough	214	Or you can place it into your pizza pan and stretch the dough to fit the pan.	### Making No-Yeast Pizza Dough	356	You can use a rolling pin to roll the pizza out to any shape you like, or you can place it into your pizza pan and stretch the dough to fit the pan.	72
Make_a_Pokémon_Have_a_Powerful_Return_Attack.txt	Begin_Revisions	1	0.325	## Steps	10	""" So don't hink just because you gave your Pokémon a bunch of poffins in Pokémon-Amie is gonna make your Pokémon love you-You have to have them get to know you well."	## Steps	26	""" So don't think giving Pokémon a bunch of poffins in Pokémon-Amie is going to make your Pokémon love you."	73
Choose_the_Perfect_Wedding_Cake_and_Wedding_Cake_Topper.txt	Begin_Revisions	1	0.364	## Section::::Steps.	207	Once you have found one or two bakeries that you want to try, make an appointment with them to have a cake tasting.	## Steps	226	Make an appointment with the one or two bakeries you like to have a cake tasting.	64
Be_Taken_Seriously_by_Men.txt	Begin_Revisions	1	0.485	### Showing Confidence	1250	A woman who is well informed on various topics will have a better chance of being taken seriously by men (and other women) than the woman who only can discuss what kind of latest perfume a celebrity is coming out with.	### Showing Confidence	1321	A woman who is well informed on various topics will have a better chance of being taken seriously by men (and other women).	95
Get_a_Flat_Stomach.txt	Begin_Revisions	1	0.45799999999999996	## Tips	16573	It's always good to start your day with a glass of water this not only boosts your metabolism it also rehydrates you.	## Tips	16702	It's always good to start your day with a glass of water.	60
Get_Guys_to_Come_Up_to_You.txt	Begin_Revisions	1	0.434	## Tips	1900	if he plays a sport try to watch it at home and the next time you talk to him relate to last nights game, it will fire up a conversation.	## Tips	1960	The next time you talk to him, relate to last nights game; it will fire up a conversation.	51
Type_With_a_Virtual_Keyboard.txt	Begin_Revisions	1	0.461	## Warnings	3021	On-screen keyboards are great for security against keyloggers--viruses that track your keystrokes to steal sensitive data such as passwords and login information--but you should still never enter your personal information into a site that you don't trust.	## Warnings	3078	On-screen keyboards are great for security against keyloggers, but you should still never enter your personal information into a site that you don't trust.	101
