Article_Name	Revision_Tag	Revision_Length	BLEU_Score	Section_Src	Line_No_Src	Source_Line	Section_Tgt	Line_No_Tgt	Target_Line	edit_distance
Be_a_Hospital_Advocate.txt	Begin_Revisions	1	0.402	### Communicating with and on Behalf of the Patient	1330	This condition is made even more likely by certain narcotics that may be used to relieve pain, such as Haldol.	### Communicating with and on Behalf of the Patient	1402	This condition may be made more likely by certain drugs that may be used to relieve pain, such as narcotics (analgesics) and sedative hypnotics (benzodiazepines).	76
Hit_Altissimo_Notes_on_the_Sax.txt	Begin_Revisions	1	0.479	## Warnings	72	Practicing more than 10 minutes per day can result in blood, jaw maladies and damage! I aggravated an old abcess doing this and had to have my teeth yanked.	## Warnings	110	Practicing more than 10 minutes per day can result in blood, jaw maladies and damage! So take it easy!	61
Play_Big_Booty.txt	Begin_Revisions	1	0.40299999999999997	## Tips	7912	"On beats 3 and 4, the person who is ""it"" says and does name and action of the next person, while everyone else does ""left snap, right snap""."	## Tips	7984	On beats 3 and 4, the person singing gives the name and performs the action of the next person while everyone else does a left snap and a right snap to keep the tempo.	53
Hire_an_Inspirational_Speaker.txt	Begin_Revisions	1	0.43	## Steps	126	You want your attendees to walk away from the session saying “What a great speaker!” not “Wow did that speaker ever tie into the event theme well!”	## Steps	153	You want your attendees to walk away from the session saying “What a great speaker!.”	63
Get_Most_People_to_Like_You.txt	Begin_Revisions	1	0.396	## Steps	40	2 look mature and neat-people will see you and think you would be a great friend.	## Steps	70	smile-when people see you smile they wiil think your are nice and want get know you and be your friend. # look mature and neat-people will see you and think you would be a great friend.	105
Avoid_Getting_Romantically_Involved_with_the_Wrong_Person.txt	Begin_Revisions	1	0.311	### Evaluating a Person’s Character	3409	Other questions to determine is their value of money, passion, romance, or career, and how it correspond with your own life goals.	### Evaluating a Person’s Character	3480	You can also ask questions to determine how much they value money, passion, romance, or career.	77
Treat_Skin_Sensitivity_Associated_With_Fever.txt	Begin_Revisions	1	0.425	## Warnings	526	For infants contact your doctor regarding the fever if (a) 1-3 month old has a temperature higher than 100.4F or 38C, (b) 3-6 month old has a temperature above 102F or 38.9C, © 6-24 month old has a temperature higher than 102F or 38.9C for more than one day, For children older than 2 years, contact a doctor if they have a fever plus other symptoms.	## Warnings	575	“Normal” body temperature is 98.6 °F or 37 °C. For infants contact your doctor regarding the fever if (a) your one- to three-month-old has a temperature higher than 100.4 °F or 38C, (b) your three- to six-month-old has a temperature above 102 °F or 38.9 °C, (c) your six- to 24-month-old has a temperature higher than 102 °F or 38.9 °C for more than one day, For children older than two years, contact a doctor if they have a fever plus other symptoms.	113
Make_Friends_All_over_the_World.txt	Begin_Revisions	1	0.665	## Steps	5030	Or, find a good and secure website that allows you to talk to students and teachers all over the world, like Students Of The World.	## Steps	5090	You can search for a pen pal in any specific country,or find a good and secure website that allows you to talk to students and teachers all over the world, like Students Of The World.	53
Stop_SimCity_4_Crashing.txt	Begin_Revisions	1	0.639	## Steps	231	"In the box labeled ""Target"" you should see the file path to SimCity4.exe (by default ""C:\Program Files (x86)\Maxis\SimCity 4 Deluxe\Apps\SimCity 4.exe"")."	## Steps	253	"In the box labeled ""Target"" you should see the file path to SimCity4.exe (by default ""C:\Program Files\Maxis\SimCity 4 Deluxe\Apps\SimCity 4.exe""; 64-bit systems the path will be the same except that the files will be in Program Files (x86)."	100
Identify_Bed_Bug_Bites.txt	Begin_Revisions	1	0.37	### Checking Your Bed	94	Examine the folds of mattresses and sheets for the bugs.	### Checking Your Bed	131	Check for reddish-brown, wingless, flat insects that are about 0.1 cm to 0.7 cm. Examine the folds of mattresses and sheets for the bugs.	81
Treat_a_Cat_With_a_Cold.txt	Begin_Revisions	1	0.486	### Caring for Your Cat at Home	1991	Many will cry and/or scratch at the door to get out If your cat does this for longer than 3-5 minutes, don't force them.	### Caring for Your Cat at Home	2044	If your cat does this for longer than 3-5 minutes, don't force them.	52
Clean_White_Leather.txt	Begin_Revisions	1	0.38	### Using Liquid Cleaners	488	Not only is it easy and cost-effective to make your own liquid cleaner, but it can be safer for your leather.	## Section::::Quick Summary.	559	To clean white leather, make your own liquid cleaner, which is more cost-effective as well as safer for your leather.	61
Draw_a_Megalodon_Shark.txt	Begin_Revisions	1	0.47600000000000003	## Steps	87	Add a basic split-tail, big nose that's almost flat at the top and then slants down and back.	## Steps	103	Add a basic split-tail, (consists of a rectangle and two overlapping ovals on the back of the oval), a big nose that's almost flat at the top and then slants down and back.	79
Write_a_Living_Will.txt	Begin_Revisions	1	0.315	### Locate the Proper Form	2325	Visit Rocket Lawyer at http://www.rocketlawyer.com/documents/living-will.aspx.	### Locating the Proper Form	2390	Visit Rocket Lawyer here.	53
Treat_Hepatitis_A.txt	Begin_Revisions	1	0.609	### Treating Hepatitis A	1004	Over-the-counter pain medication such as ibuprofen (Advil, Motrin) and acetaminophen (Tylenol) can help reduce painful symptoms, but keep your dosage well below maximum recommended amounts.	### Treating Hepatitis A	1072	Ibuprofen (Advil, Motrin) can help reduce painful symptoms, but keep your dosage well below maximum recommended amounts.	70
Make_a_Clan_in_Animal_Jam_(Members).txt	Begin_Revisions	1	0.36	### Roleplaying	3390	That way, every time you come on to roleplay, your Clan will be ready for you.	#### Understanding the Rules of Roleplaying	3558	Tell everyone to meet you in camp every time you come on to roleplay with your Clan.	56
Regain_Trust_in_Someone.txt	Begin_Revisions	1	0.493	### The betrayal	4404	It can be difficult to confront someone who seems indifferent to your feelings, but sometimes people are just oblivious, and a flawed dynamic and poor behavior can be talked through and resolved.	### Part Two: Taking Stock of What's Left	4486	It can be difficult to confront someone who seems indifferent to your feelings, but sometimes people are just oblivious.	75
Maintain_Normal_Cholesterol_Levels.txt	Begin_Revisions	1	0.65	### Getting Your Cholesterol Checked	802	Keep in mind that regular screenings are important as you age since cholesterol levels usually increase as you get older.	### Getting Your Cholesterol Checked	894	Keep in mind that regular screenings are important as you age since cholesterol levels usually increase due to lifestyle changes and decreased activity levels as you get older.	55
Paint_the_Exterior_of_a_Wooden_Structure.txt	Begin_Revisions	1	0.465	## Section::::Steps.	102	A three and one-half inch acrylic angle brush is light, easy	## Steps	147	A three and one-half inch acrylic angle brush is light, easy to use, and can be used for nearly every application.	54
Determine_Shipping_Costs.txt	Begin_Revisions	1	0.563	Intro	577	Whether you're figuring out how much it'll cost to send a package, determining how much to charge customers for an online business, or ordering packages online, it's a good idea to determine shipping costs ahead of time.	Intro	635	Whether you're figuring out how much it'll cost to send something, ordering packages online, or determining how much to charge customers, it's a good idea to figure out shipping costs well in advance.	98
Cope_With_Type_2_Diabetes.txt	Begin_Revisions	1	0.638	### Trying Other Coping Strategies	687	Know that, if you are pre-diabetic or in the early stages of diabetes, you may even be able to reverse the condition! Just because you have received the diagnosis does not mean you are doomed to live with it for life.	### Trying Other Coping Strategies	762	Know that you may even be able to reverse the condition! Just because you have received the diagnosis does not mean you are doomed to live with it for life.	61
Pick_a_Survival_Horror_Game.txt	Begin_Revisions	1	0.547	## Tips	386	If you don't like just shooting and killing creatures and want a more atmospheric and different gameplay.	## Tips	423	If you don't like just shooting and killing creatures and want a more atmospheric and different gameplay, try the fatal frame series where your only weapon is a camera.	63
Develop_a_Leadership_Vision_for_a_Business.txt	Begin_Revisions	1	0.45899999999999996	## Steps	90	So it is important to be aware of the environment in which your business operates.	## Steps	115	Every business thrives in a very dynamic environment, which has deep impacts on the business, so it is important to be aware of the environment in which your business operates.	95
Afford_Designer_Clothing.txt	Begin_Revisions	1	0.46299999999999997	## Steps	2218	"There are also more expensive designers and cheaper designers (to give a few examples, Juicy Couture, Versace Jeans Couture and Ralph Lauren are the ""cheaper""-but still expensive- designer brands, while Christian Dior is among the most expensive)."	## Steps	2281	"Brands such as Juicy Couture, Versace Jeans Couture and Ralph Lauren are the ""cheaper""-but still expensive-designer brands, (while Dior is among the most expensive)."	87
Test_a_Thermocouple.txt	Begin_Revisions	1	0.536	### Turning on the Pilot Light	111	Look at the dial to locate a position labeled “Off.	### Turning on the Pilot Light	159	To double-check that the thermocouple is at fault, look at the dial to locate a position labeled “Off.	52
Lower_Prostate–Specific_Antigens_(PSA).txt	Begin_Revisions	1	0.39299999999999996	### Getting Medical Help for Lowering PSA Levels	1236	However, this secondary benefit is cancelled out if you're also taking calcium channel blockers for high blood pressure.	### Getting Medical Help for Lowering PSA Levels	1297	Cholesterol-lowering medications called statins (Lipitor, Crestor, Zocor) are also linked to lower PSA levels — if they're taken for a few years or more; however, this secondary benefit is cancelled out if you're also taking calcium channel blockers for high blood pressure.	155
Set_up_a_White's_(Dumpy)_Tree_Frog_Enclosure.txt	Begin_Revisions	1	0.547	## Steps	44	Firstly you will need a UV light A timer will set to 8 hours a day will turn the light on and off for you (you will need to replace the bulb every 6-8 months).	## Steps	76	The timer will turn the light on and off for you (you will need to replace the bulb every 6-8 months).	59
Cope_with_Discontinuing_Sertraline.txt	Begin_Revisions	1	0.542	## Tips	554	However, the psychological/emotional effects of discontinuation can be severe.	## Tips	625	Discontinuation is not dangerous, however, the psychological/emotional effects can be severe.	54
Make_a_Healthier_Hamburger.txt	Begin_Revisions	1	0.324	### Choosing Healthy Toppings For Your Burger	425	Avocado is a superfood that is healthy and delicious.	### Choosing Healthy Toppings For Your Burger	509	Avocado is a superfood that is healthy and delicious (though it is high in calories, so don't use too much).	55
Avoid_the_Temptation_to_Eat_Unhealthy_Foods.txt	Begin_Revisions	1	0.45299999999999996	## Steps	5003	Also, stress can lead to a Vitamin B deficiency, so if your	## Steps	5150	Also, stress can lead to a Vitamin B deficiency, so if your experiencing hardship, take a second Vitamin B supplement half way through your day.	85
Dye_Lace.txt	Begin_Revisions	1	0.32299999999999995	### Dye Whole Pieces	1513	Remove the dyed lace from the dye bath and rinse it under warm water for a couple of minutes.	### Creating an Ombre Look	1671	Remove the lace from the dye bath and immediately rinse it under lukewarm running water until the water runs clear.	51
Repot_a_Plant.txt	Begin_Revisions	1	0.546	## Steps	2215	After several tries, if the plant still doesn't come out, use a knife to cut around the edge of the soil.	### Preparing the Plant	2267	If the plant won’t come out after several tries, you can use a knife to cut around the edge of the soil and try again.	61
Use_the_Near_Future_Tense_(Spanish).txt	Begin_Revisions	1	0.444	### Constructing Informal Future Tense	645	"For example, if you wanted to say ""I am going to study a lot"" in Spanish, you would say Yo voy a estudiar mucho (yo boy ah ess-too-DEE-ahr MOO-choh)."	### Constructing Informal Future Tense	700	"For example, if you wanted to say ""I am going to learn Spanish,"" you would say Voy a aprender español (boy ah ah-pren-der ess-PAN-yohl)."	55
Breed_Syrian_Hamsters.txt	Begin_Revisions	1	0.326	## Steps	3190	Once they reach about a week, start to scatter small portions of broccoli or grated carrot on their nest, for them to eat.	### Taking Care of the New Litter	3290	Scatter small portions of broccoli, grated carrot, wheat germ, or tofu in their nest for them to eat.	65
Create_Your_Own_R&B_Beats.txt	Begin_Revisions	1	0.41100000000000003	### Making R&B Beats with a Sampler	1203	There is a lot of competition for these types of products.	### Making R&B Beats with a Sampler	1275	There is a lot of competition for these types of products, so you should be able to find one that fits your needs.	56
Sharpen_a_Sword.txt	Begin_Revisions	1	0.33799999999999997	### File Sharpening.	637	Use a good light source to find the parts you've missed.	### File Sharpening.	688	Use a good light source to find the parts you've missed or even use a marker and draw on the edge, then sharpen until all the marker is worn off.	89
Prepare_for_Kittens.txt	Begin_Revisions	1	0.49700000000000005	### Preparing for the Birth of a Litter of Kittens	1098	Gather together all the supplies you might need if there are any problems with the birth so you can act quickly and provide the best possible care.	### Preparing for the Birth of a Litter of Kittens	1178	Gather together all the supplies you might need if there are any problems with the birth.	58
Sit_in_the_Saddle_When_Riding.txt	Begin_Revisions	1	0.485	Intro	448	When competing, proper posture is even more important, because you and your horse must move together and be completely balanced.	Intro	499	When competing, proper posture is even more important, because you will be judged.	53
Become_a_Handbag_Designer.txt	Begin_Revisions	1	0.42	## Steps	4900	Look at suitcases, backpacks, messenger bags, purses,	## Steps	5008	Look at suitcases, backpacks, messenger bags, purses, lunchboxes, diaper bags, coin purses, knitting bags, anything.	63
Manage_Pastures_Using_Rotational_or_Management_Intensive_Grazing.txt	Begin_Revisions	1	0.365	### Calculations for Stocking Pastures	6209	Each may slightly differ in the amount of herbage in terms of pounds per acre (or kilograms per hectare), though most notable differences will be seen on hill tops versus in lowlands or low-lying areas.	### Calculations for Stocking Pastures	6349	Each may slightly differ in the amount of herbage (or forage yield) in terms of pounds per acre or kilograms per hectare.	114
Receive_Power_from_God_(Christianity).txt	Begin_Revisions	1	0.469	## Tips	8295	Acts 1:8 But ye shall receive power, after that the Holy Ghost is come upon you: and ye shall be witnesses unto me both in Jerusalem, and in all Judaea, and in Samaria, and unto the uttermost part of the earth.	## Steps	8342	"They are in Luke 24:49 ""And, behold, I send the promise of my Father upon you: but tarry ye in the city of Jerusalem, until ye be endued with power from on high"", and Acts 1:8 ""But ye shall receive power, after that the Holy Ghost is come upon you: and ye shall be witnesses unto me both in Jerusalem, and in all Judea, and in Samaria, and unto the uttermost part of the earth."""	170
Connect_Hard_Drive_to_Android_Smartphone.txt	Begin_Revisions	1	0.33299999999999996	## Steps	82	Remember that all data on the Disc will be wiped out.	## Steps	114	"Remember all data on the Disc will be wiped out.! And you should copy them back from ""backup"" that we was made previously."	79
Help_Your_Dog_Whelp_or_Deliver_Puppies.txt	Begin_Revisions	1	0.485	### Getting Ready	12612	By 45 days into the pregnancy, your vet can use x-rays to detect the number of puppies in the litter.	### Getting Ready	12736	The vet will be able to count the number of puppies in the litter using x-rays by 45 days into the pregnancy.	84
Learn_Guitar_Scales.txt	Begin_Revisions	1	0.618	### Major Scales	2486	For example, if we're starting on G, first we'd move up one whole step to A. Then, we'd move up another whole step to B. Then, we'd move up a half step to C. Following the pattern above, we would continue up the scale, playing D, E, F#, and ending on G.	### Practicing Major Scales	2646	If you start on G, move up one whole step to A. Then, move up another whole step to B. After that, move up a half step to C. Following the pattern above, continue up the scale, playing D, E, F#, and ending on G.	57
Ripple_Roll.txt	Begin_Revisions	1	0.48200000000000004	### Section I: Grip	263	Wrap your ring finger and pinkie around the mallet so that the tips of both fingers press against your palm near the butt of your other mallet.	### Gripping the Mallet	326	The tips of both fingers should press against your palm near the butt of your other mallet.	67
Make_a_Water_Wheel.txt	Begin_Revisions	1	0.535	### Using Plastic Spoons	3711	After the glue has dried, you can insert the wooden skewer, which will serve as your dowel rod and will allow the wheel to turn when water passes over the spoons.	### Using Plastic Spoons	3794	The skewer will serve as your dowel rod and will allow the wheel to turn when water passes over the spoons.	56
Make_Cool_Weather_Minimalist_Running_Shoes.txt	Begin_Revisions	1	0.447	## Section::::Things You'll Need.	55	If you are interested in starting out in barefoot and minimalist running or looking to extending your outdoor running season then these might be the shoes for you.	## Section::::Things You'll Need.	105	Some studies even suggest that running barefoot might also result in fewer injuries! If you are interested in starting out in barefoot running and want transition footwear, or if you're already minimalist running or looking to extending your outdoor running season, then these might be the shoes for you.	141
Be_a_Neutral_Girl.txt	Begin_Revisions	1	0.326	## Steps	100	don't try to have other's type of life.	## Steps	130	don't try to have other's type of life go with your beliefs its your life be you not your friends or your sister be you.	81
Write_a_Living_Will.txt	Begin_Revisions	1	0.9209999999999999	### Locate the Proper Form	2314	A listing of each state’s witness requirements along with a link to its statute(s) concerning advanced medical directives and living wills can be found on Find Law’s website at http://estate.findlaw.com/living-will/living-wills-state-laws.html.	### Locating the Proper Form	2379	A listing of each state’s witness requirements along with a link to its statute(s) concerning advanced medical directives and living wills can be found on Find Law’s website here.	66
Tell_if_a_Boy_Likes_You,_Even_if_He_Already_Has_a_Boyfriend.txt	Begin_Revisions	1	0.369	## Steps	46	These could be studying, book club, rugby, car pooling, etc.	## Steps	91	These excuses he is coming up with could include be studying for exams or just in general, book club, rugby, car pooling, etc.	66
Make_a_Free_Website.txt	Begin_Revisions	1	0.42700000000000005	## Section::::Tips.	22934	provide further information on the products and services of the host.	## Tips	23045	Look at the web service's Frequently Asked Questions (FAQs) which will provide further information on the products and services of the host.	71
"Use_""Find""_in_Excel_VBA_Macros.txt"	Begin_Revisions	1	0.45	## Steps	304	So if we take an then the range would be Range(“A1:A” & lastRow)	## Steps	377	So if we take an example then the range would be Range(“A1:A” & lastRow) where lastRow has been DIMensioned as type long and there is a statement: lastRow = oSht.	98
Heal_Armpit_Rash.txt	Begin_Revisions	1	0.301	## Steps	606	An oil containing Vitamin E may help.	### Part Two: Treating the Rash	659	An oil containing vitamin E may help, although topical vitamin E may irritate the skin of some people.	66
Declutter_Your_Bedroom.txt	Begin_Revisions	1	0.496	### Cleaning and Organizing Your Room	2809	also get the clutter out of your room or somewhere in your room it would not be seen or in a corner and then put it somewhere else	### Cleaning and Organizing Your Room	2902	Also, get the clutter out of your room or put it somewhere in your room where it would not be seen.	59
Treat_Epstein_Barr_Virus_(EBV).txt	Begin_Revisions	1	0.618	### Reducing Risk of EBV Infection	2178	Vitamin D3 is produced in your skin in response to intense summer sunshine and a necessary part of a healthy immune system — consider supplementing with D3 during winter months.	### Reducing Risk of EBV Infection	2241	Vitamin D3 is produced in your skin in response to intense summer sunshine and a necessary part of a healthy immune system — consider supplementing with D3 during winter months or year-round if you are not exposed to at least 15 minutes of direct sunshine every day.	89
Insec_in_League_of_Legends.txt	Begin_Revisions	1	0.359	## Section::::Steps.	221	In 2013 during a professional match of League of Legends, a Jungler by the name of Insec was playing as Lee Sin.	## Section::::Steps.	242	In 2013 during a professional match of League of Legends, a Jungler by the name of Insec was playing as Lee Sin, dashed into the middle of the enemy team, quickly placed a ward behind the enemy carry, dashed a second time to the ward, and then kicked the enemy toward the rest of his team.	177
Lose_Weight_Just_by_Exercising.txt	Begin_Revisions	1	0.483	Intro	5979	However, you don’t have to go on a strict diet or count every calorie to be successful in weight loss.	Intro	6084	Weight loss doesn’t have to be complicated: if you burn more calories than you consume, you’ll lose weight! However, you don’t have to go on a strict diet or count every calorie to be successful in weight loss.	108
Fall_Asleep_at_a_Sleepover.txt	Begin_Revisions	1	0.39799999999999996	## Steps	322	When you go to where you're sleeping, make sure you know what to do.	## Steps	349	When you go to where you're sleeping, make yourself comfortable and make sure you're in an environment where you can fall asleep.	68
Clean_Clogged_Pores.txt	Begin_Revisions	1	0.44	### Steaming Your Skin	6334	However, it can help you get out dirt that’s trapped deep inside.	### Steaming Your Skin	6416	It relaxes the muscles under your skin and makes it easier to clean, so it can help you get out dirt that’s trapped deep inside.	66
Be_a_Mature_Kid_Without_Changing_Who_You_Are.txt	Begin_Revisions	1	0.306	## Steps	26	Switch information, and learn about his or her life! Double points if your mate is around your age, and has a family like you! You may have found a new friend!	## Steps	40	Double points if your mate is around your age, and has a family like you.	87
Prepare_a_Writing_Sample.txt	Begin_Revisions	1	0.524	## Steps	492	In some cases, the type of writing will dictate the length of the sample: blogs and press releases typically run from 300 to 500 words, while legal memoranda should run 5 to 10 pages.	### Choosing the Right Sample	534	For example, blogs and press releases typically run from 300 to 500 words, while legal memoranda should run 5 to 10 pages.	64
Know_when_to_Let_Go.txt	Begin_Revisions	1	0.35	Intro	15769	Now when that person continues to hurt you and does things knowing it will get you upset, it's time to let go.	Intro	15852	Now when that person continues to hurt you and does things knowing it will get you upset,don't let the person continue doing that,do not encourage it by excusing him/her on and every time,make the person you too have self esteem and respect,instead,tell your self it's time to let go.	174
Purchase_Right_Solar_Panel_for_Your_Home.txt	Begin_Revisions	1	0.584	## Steps	46	Selecting the right solar panels - Many varieties of solar panels are available to confuse you and make it a tough decision to choose the right one that suits to your need.	## Steps	63	Many varieties of solar panels are available, which makes it a tough decision to choose the right one that suits to your need.	54
Use_Google_Drive_As_an_Ftp_Server_to_Record_Video_from_an_IP_Camera.txt	Begin_Revisions	1	0.48	## Steps	28	Alternatively you can create a folder anywhere on your computer and set google drive app to upload all files in that folder to google drive.	## Steps	45	Set google drive app to upload all files in that folder to google drive.	69
Replace_Heater_Core_on_a_Corsica.txt	Begin_Revisions	1	0.3	## Things You'll Need	861	Antifreeze and distilled water or the quick fill; as required in your owners manual, rags and newspapers, a drain pan.	## Things You'll Need	914	Antifreeze and distilled water (or a quick fill kit, as described in your owner's manual), rags and newspapers, a drain pan, new clamps and possibly new heater hoses.	58
